{
  "$schema": "https://json-schema.org/draft/2020-12/schema",
  "$id": "https://tinyworld.local/world.schema.json",
  "title": "TinyWorld",
  "description": "Scene description for Tiny World Builder. Uses sparse v4 cells.",
  "type": "object",
  "additionalProperties": false,
  "required": ["v", "cells"],
  "properties": {
    "v": {
      "type": "integer",
      "enum": [4]
    },
    "gridSize": {
      "type": "integer",
      "enum": [8, 12, 16, 20, 32, 48]
    },
    "cells": {
      "type": "array",
      "items": {
        "$ref": "#/$defs/cell"
      }
    },
    "cameraMode": {
      "type": "string",
      "enum": ["ortho", "topdown", "perspective", "fp"]
    },
    "toolId": {
      "type": "string"
    },

    "useLandscapeEngine": {
      "type": "boolean"
    },
    "landscapeMeshMode": {
      "type": "boolean"
    },
    "landscapeMeshBiome": {
      "type": "string",
      "enum": ["grassland", "desert", "snow"]
    },
    "landscapeMeshStyle": {
      "type": "string",
      "enum": ["lowpoly", "realistic"]
    },
    "landscapeEngineSeed": {
      "type": ["number", "string", "null"]
    },
    "landscapeEngineBiome": {
      "type": ["string", "null"],
      "enum": ["grassland", "desert", "snow", null]
    },
    "planetLandscape": {
      "type": ["object", "null"],
      "additionalProperties": false,
      "properties": {
        "enabled": { "type": "boolean" },
        "seed": { "type": ["number", "string"] },
        "biome": {
          "type": "string",
          "enum": ["grassland", "desert", "snow"]
        },
        "styleMode": {
          "type": "string",
          "enum": ["lowpoly", "realistic"]
        },
        "drop": {
          "type": "number",
          "minimum": 20,
          "maximum": 300
        }
      }
    }
  },
  "$defs": {
    "coord": {
      "type": "integer",
      "minimum": -1024,
      "maximum": 1024
    },
    "terrain": {
      "type": "string",
      "enum": ["grass", "path", "dirt", "water", "stone", "lava", "sand", "snow"]
    },
    "kind": {
      "type": ["string", "null"],
      "enum": [
        null,
        "house",
        "tree",
        "fence",
        "rock",
        "bridge",
        "crop",
        "corn",
        "wheat",
        "pumpkin",
        "carrot",
        "sunflower",
        "tuft",
        "flower",
        "bush",
        "cow",
        "sheep",
        "voxel-build",
        "model-stamp"
      ]
    },
    "buildingType": {
      "type": ["string", "null"],
      "enum": [null, "cottage", "manor", "tower", "turret", "skyscraper"]
    },
    "fenceSide": {
      "type": ["string", "null"],
      "enum": [null, "n", "s", "e", "w", "center-x", "center-z"]
    },
    "extra": {
      "type": "object",
      "additionalProperties": false,
      "properties": {
        "kind": {
          "type": "string",
          "enum": ["fence", "tuft"]
        },
        "k": {
          "type": "string",
          "enum": ["fence", "tuft"]
        },
        "fenceSide": {
          "$ref": "#/$defs/fenceSide"
        },
        "s": {
          "$ref": "#/$defs/fenceSide"
        },
        "floors": {
          "type": "integer",
          "minimum": 1,
          "maximum": 8
        },
        "f": {
          "type": "integer",
          "minimum": 1,
          "maximum": 8
        }
      },
      "anyOf": [
        { "required": ["kind"] },
        { "required": ["k"] }
      ]
    },
    "extras": {
      "type": ["array", "null"],
      "items": {
        "$ref": "#/$defs/extra"
      }
    },
    "appearance": {
      "type": ["object", "null"],
      "additionalProperties": false,
      "properties": {
        "bodyColor": {
          "type": "string",
          "pattern": "^#[0-9a-fA-F]{6}$"
        },
        "topColor": {
          "type": "string",
          "pattern": "^#[0-9a-fA-F]{6}$"
        },
        "voxelBuildId": {
          "type": "string",
          "pattern": "^[a-zA-Z0-9][a-zA-Z0-9_-]{0,63}$"
        },
        "modelStampId": {
          "type": "string",
          "pattern": "^[a-zA-Z0-9][a-zA-Z0-9_-]{0,95}$"
        },
        "objectScale": {
          "type": "number",
          "minimum": 0.2,
          "maximum": 4
        },
        "scaleX": {
          "type": "number",
          "minimum": 0.15,
          "maximum": 5
        },
        "scaleY": {
          "type": "number",
          "minimum": 0.15,
          "maximum": 5
        },
        "scaleZ": {
          "type": "number",
          "minimum": 0.15,
          "maximum": 5
        },
        "materialTexture": {
          "type": "string"
        },
        "materialTextureScale": {
          "type": "number",
          "minimum": 0.5,
          "maximum": 4
        },
        "bodyTexture": {
          "type": "string"
        },
        "bodyTextureScale": {
          "type": "number",
          "minimum": 0.5,
          "maximum": 4
        },
        "topTexture": {
          "type": "string"
        },
        "topTextureScale": {
          "type": "number",
          "minimum": 0.5,
          "maximum": 4
        },
        "objectStyle": {
          "type": "string",
          "enum": ["normal", "voxel"]
        }
      }
    },
    "transform": {
      "oneOf": [
        {
          "type": "array",
          "minItems": 3,
          "maxItems": 4,
          "prefixItems": [
            { "type": "number", "description": "rotationY in radians" },
            { "type": "number", "description": "offsetX in tile units" },
            { "type": "number", "description": "offsetZ in tile units" },
            { "type": "number", "description": "offsetY in tile units" }
          ],
          "items": false
        },
        {
          "type": "object",
          "additionalProperties": false,
          "properties": {
            "rotationY": { "type": "number" },
            "offsetX": { "type": "number" },
            "offsetZ": { "type": "number" },
            "offsetY": { "type": "number" }
          }
        }
      ]
    },
    "cellObject": {
      "type": "object",
      "additionalProperties": false,
      "required": [
        "x",
        "z",
        "terrain",
        "kind",
        "floors",
        "terrainFloors",
        "buildingType",
        "fenceSide"
      ],
      "properties": {
        "x": { "$ref": "#/$defs/coord" },
        "z": { "$ref": "#/$defs/coord" },
        "terrain": { "$ref": "#/$defs/terrain" },
        "kind": { "$ref": "#/$defs/kind" },
        "floors": {
          "type": "integer",
          "minimum": 1,
          "maximum": 8
        },
        "terrainFloors": {
          "type": "integer",
          "minimum": 1,
          "maximum": 8
        },
        "buildingType": { "$ref": "#/$defs/buildingType" },
        "fenceSide": { "$ref": "#/$defs/fenceSide" },
        "extras": { "$ref": "#/$defs/extras" },
        "transform": { "$ref": "#/$defs/transform" },
        "appearance": { "$ref": "#/$defs/appearance" }
      }
    },
    "cellTuple": {
      "type": "array",
      "minItems": 4,
      "maxItems": 11,
      "prefixItems": [
        { "$ref": "#/$defs/coord", "description": "x" },
        { "$ref": "#/$defs/coord", "description": "z" },
        { "$ref": "#/$defs/terrain", "description": "terrain" },
        { "$ref": "#/$defs/kind", "description": "kind" },
        {
          "type": "integer",
          "minimum": 1,
          "maximum": 8,
          "description": "floors"
        },
        { "$ref": "#/$defs/buildingType", "description": "buildingType" },
        {
          "type": "integer",
          "minimum": 1,
          "maximum": 8,
          "description": "terrainFloors"
        },
        { "$ref": "#/$defs/fenceSide", "description": "fenceSide" },
        { "$ref": "#/$defs/extras", "description": "extras" },
        { "$ref": "#/$defs/transform", "description": "transform" },
        { "$ref": "#/$defs/appearance", "description": "appearance" }
      ],
      "items": false
    },
    "cell": {
      "oneOf": [
        { "$ref": "#/$defs/cellObject" },
        { "$ref": "#/$defs/cellTuple" }
      ]
    }
  }
}